{
  "$schema": "https://json-schema.org/draft/2020-12/schema",
  "$id": "https://travelglobe.app/schemas/journey.schema.json",
  "title": "Journey",
  "type": "object",
  "required": [
    "schemaVersion",
    "appVersion",
    "id",
    "title",
    "startTime",
    "status",
    "plans",
    "segments",
    "events",
    "media",
    "journal",
    "metadata"
  ],
  "additionalProperties": false,
  "properties": {
    "schemaVersion": { "type": "string", "pattern": "^1\\.0\\.0$" },
    "appVersion": { "type": "string", "pattern": "^0\\.1\\.0$" },
    "id": { "type": "string", "minLength": 1 },
    "title": { "type": "string", "minLength": 1 },
    "subtitle": { "type": "string" },
    "startTime": { "type": "string", "format": "date-time" },
    "endTime": { "type": "string", "format": "date-time" },
    "homeLocation": {
      "type": "object",
      "additionalProperties": false,
      "properties": {
        "latitude": { "type": "number", "minimum": -90, "maximum": 90 },
        "longitude": { "type": "number", "minimum": -180, "maximum": 180 }
      }
    },
    "status": {
      "type": "string",
      "enum": ["planned", "recording", "completed", "archived"]
    },
    "plans": {
      "type": "array",
      "items": { "$ref": "https://travelglobe.app/schemas/travel-plan.schema.json" }
    },
    "segments": {
      "type": "array",
      "minItems": 1,
      "items": { "$ref": "https://travelglobe.app/schemas/flight-segment.schema.json" }
    },
    "events": {
      "type": "array",
      "items": { "$ref": "https://travelglobe.app/schemas/timeline-event.schema.json" }
    },
    "media": {
      "type": "array",
      "items": { "$ref": "https://travelglobe.app/schemas/media-item.schema.json" }
    },
    "journal": {
      "type": "array",
      "items": { "type": "object", "additionalProperties": true }
    },
    "statistics": {
      "type": "object",
      "additionalProperties": true
    },
    "settings": {
      "type": "object",
      "additionalProperties": true
    },
    "metadata": {
      "type": "object",
      "additionalProperties": true
    }
  }
}
